Task,Due Date,Priority,Status,List,Notes
Reply to Sarah Chen — Q4 APAC numbers,2026-02-07,High,Not Started,Work,"Sarah emailed 11:47 PM last night. She needs confirmed APAC revenue figures before Monday's earnings prep. Quick reply — numbers are in the Q4 deck slide 14."
Read NDA flag from Jessica Torres,2026-02-07,High,Not Started,Work,"URGENT: Contoso NDA Section 7.3 non-compete clause is too broad. Must read before seeing David Park at tonight's dinner. 5 minutes."
Test demo app — dry run at 2 PM,2026-02-07,High,Not Started,Work,"Sandra wants to see the AI Agent demo working at Mountain Winery. Launch app, test all flows, verify offline mode works."
Skim AI governance deck v3,2026-02-07,Medium,Not Started,Work,"Alex sent updated deck last night. James Liu (board member) is attending tonight and has been asking about AI guardrails. Be ready to discuss."
Review guest list for tonight,2026-02-07,Medium,Not Started,Work,"Sandra sent the RSVP list this morning. 42 confirmed. Know who's at your table (Table 3)."
Order case of Mountain Winery Estate Cabernet,2026-02-07,Medium,Not Started,Personal,"Rachel Martinez's birthday is Feb 15. She loved the Mountain Winery wines. Ask about the Estate Cabernet during tonight's wine tasting."
Confirm Super Bowl suite details for Sunday,2026-02-07,Low,Not Started,Personal,"Sandra mentioned the company has a suite at Levi's Stadium for Sunday. Need to confirm arrival time and parking logistics."
Approve Kevin's event playlist,2026-02-07,Low,Not Started,Work,"Kevin sent the demo hall playlist for tonight. Looks good — heavy on Chappell Roan (Pink Pony Club, Casual, After Midnight) plus some Sabrina Carpenter and Charli XCX. Just make sure nothing too loud for the dinner crowd. Tell him Good Luck Babe is the perfect closer."
